<?xml version="1.0" encoding="UTF-8"?>
<!DOCTYPE staff SYSTEM "/htmlentities.dtd">
<about xmlns:xsi="http://www.w3.org/2001/XMLSchema-instance" xsi:noNamespaceSchemaLocation="about.xsd">
        <!-- Текст -->
        <p>
                <i>5 марта 2007 года Александр Георгиевич Барт скоропостижно скончался. Похоронен на Волковском лютеранском кладбище. Светлая ему память!</i><br/>
                <a href="/vega/bart/bart_in_memory.htm">Памяти А.Г. Барта</a><br/>
                <a href="/vega/bart/ag_bart.htm">Александр Георгиевич Барт — человек светлой души</a><br/><br/>
                <a href="/vega/bart/vvv01.htm">Сорок лет общения с Александром Георгиевичем Бартом</a>
        </p>
        <br/>
        <p>Барт А.Г. основал на кафедре биометрическое направление работ
на базе широко известного городского Биометрического Семинара. Главной
целью этих исследований является разработка математического
аппарата, отражающего логику развития биосистем. Методы работы
опираются
на непосредственные контакты с экспериментаторами по решению реальных
проблем медико-биологического плана. </p>
        <p>Имеются реальные применения результатов, в частности, в
вопросах паразитологии, нейрофизиологии, иммунологии (бронхиальная
астма, гингивит), в кардиологии, в анализе раневых процессов, в вопросах
влияния рекламы на маркетинг продаж и т.д. </p>
        <p>По его руководством велись совместные работы с НИИ эволюционной физиологии и биохимии им.
И.М.Сеченова и с ВМА, в которых участвовали
также студенты и аспиранты кафедры.</p>
</about>
