<?xml version="1.0" encoding="UTF-8"?>
<!DOCTYPE staff SYSTEM "/htmlentities.dtd">
<about xmlns:xsi="http://www.w3.org/2001/XMLSchema-instance" 
xsi:noNamespaceSchemaLocation="about.xsd">
			<!-- Текст -->
			<p>
				<b>I. Методы стохастической оптимизации &ndash; случайного поиска
экстремума.</b>
			</p>
			<p>Исследования в области методов стохастической оптимизации
(случайный поиск) ориентируются преимущественно на задачи идентификации
моделей (оценивание параметров в сложных нелинейных моделях или поиск
экстремумов для негладких многоэкстремальных функций переменной
размерности).</p>
			<p>
				<b>II. Развитие методов прикладной многомерной статистики.</b>
			</p>
			<p>Исследования в математической статистике направлены на
установление связей между различными методами многомерной статистики,
развитие единого подхода С.Р. Рао к системе методов многомерной
статистики, не опирающегося на невырожденное многомерное нормальное
распределение и выработку методологии их применения в задачах анализа
данных.</p>
			<p>
				<b>III. Развитие методов анализа и прогноза временных рядов
("гусеница").</b>
			</p>
			<p>Исследования в теории анализа процессов были ориентированы на
исследование свойств и разработку возможных направлений развития метода
"Гусеница", а также вейвлет-анализа.</p>
			<p>
				<b>IV. Статистический анализ данных в технике, химии,
гидрологии,
медицине, экономике.</b>
			</p>
			<p>
				<b>Преподавание.</b>
			</p>
			<p>В 1974-94 гг. вел практические занятия по теории вероятностей,
читал спецкурсы по математической статистике и дополнительным главам
математической статистики на Курсах повышения математической
квалификации инженеров при ЛГУ. </p>
			<p> С 2005 г. &ndash; чтение курса "Биостатистика на ЭВМ" в
межфакультетской магистерской программе "Общественное здоровье".</p>
		</about>
