<?xml version="1.0" encoding="UTF-8"?>
<!DOCTYPE staff SYSTEM "/htmlentities.dtd">
<about xmlns:xsi="http://www.w3.org/2001/XMLSchema-instance" 
xsi:noNamespaceSchemaLocation="about.xsd">
			<br/>
			<p>
				<i>Из ответа на вопрос студентов 5-го курса &laquo;Что бы Вы пожелали студентам&raquo;:</i>
			</p>
			<p>&laquo;Есть некоторое, я даже не знаю, правило&nbsp;–&nbsp;не правило:</p>
			<ol>
				<li>надо стремиться делать только то, что тебе нравится</li>
				<li>все, что ты делаешь, надо стараться делать хорошо, вне зависимости от того, нравится тебе или не нравится.</li>
			</ol>
			<p>А по совокупности эти вещи означают вот что: не всегда возможно делать то, что тебе нравится (хоть и надо стремиться). И <span class="interesting">если ты попадаешь в ситуацию, которая тебе не нравится, то ее надо отработать и с очень большой вероятностью она тебе начнет нравиться</span>.
</p>
			<p>Это - общее правило, и для меня тоже. И к вам оно сильно, вообще говоря, относится, потому что, так или иначе, но вы попали в ту ситуацию, в которую попали: ошиблись вы или не ошиблись (&laquo;не тот самолет&raquo;, &laquo;не тот город&raquo;, &laquo;не в ту дверь зашел&raquo;), по каким причинам &ndash; это неважно. 
</p>
			<p>Это мое мнение и является объяснением моего отношения к вам.&raquo;</p>
		</about>
